00:00.0 Host bridge: Intel Corporation 4th Gen Core Processor DRAM Controller (rev 06)
00: 86 80 00 0c 06 00 90 20 06 00 00 06 00 00 00 00
10: 00 00 00 00 00 00 00 00 00 00 00 00 00 00 00 00
20: 00 00 00 00 00 00 00 00 00 00 00 00 43 10 34 85
30: 00 00 00 00 e0 00 00 00 00 00 00 00 00 00 00 00
40: 01 90 d1 fe 00 00 00 00 01 00 d1 fe 00 00 00 00
50: 03 00 00 00 0d 00 00 00 04 00 00 00 01 00 00 df
60: 05 00 00 f8 00 00 00 00 01 80 d1 fe 00 00 00 00
70: 00 00 00 ff 07 00 00 00 00 0c 00 ff 7f 00 00 00
80: 10 11 11 00 00 00 11 00 1a 00 00 00 00 00 00 00
90: 01 00 00 ff 07 00 00 00 01 00 f0 1e 08 00 00 00
a0: 01 00 00 00 08 00 00 00 01 00 00 1f 08 00 00 00
b0: 01 00 00 e0 01 00 00 e0 01 00 00 df 01 00 00 e0
c0: 00 00 00 00 00 00 00 00 00 00 00 00 00 00 00 00
d0: 00 00 00 00 00 00 00 00 00 00 00 00 00 00 00 00
e0: 09 00 0c 01 6d 80 80 42 d0 00 44 36 00 00 00 00
f0: 00 00 00 00 c8 0f 03 00 00 00 00 00 00 00 00 00

00:01.0 PCI bridge: Intel Corporation Xeon E3-1200 v3/4th Gen Core Processor PCI Express x16 Controller (rev 06)
00: 86 80 01 0c 07 04 10 00 06 00 04 06 10 00 81 00
10: 00 00 00 00 00 00 00 00 00 01 01 00 f0 00 00 00
20: f0 ff 00 00 f1 ff 01 00 00 00 00 00 00 00 00 00
30: 00 00 00 00 88 00 00 00 00 00 00 00 0b 01 14 00
40: 00 00 00 00 00 00 00 00 00 00 00 00 00 00 00 00
50: 00 00 00 00 00 00 00 00 00 00 00 00 00 00 00 00
60: 00 00 00 00 00 00 00 00 00 00 00 00 00 00 00 00
70: 00 00 00 00 00 00 00 00 00 00 00 00 00 00 00 0a
80: 01 90 03 c8 08 00 00 00 0d 80 00 00 43 10 34 85
90: 05 a0 01 00 0c f0 ef fe 81 41 00 00 00 00 00 00
a0: 10 00 42 01 00 80 00 00 00 00 00 00 83 cc 61 02
b0: 00 00 01 10 80 25 0c 00 00 00 00 00 00 00 00 00
c0: 00 00 00 00 80 0b 08 00 00 64 00 00 0e 00 00 00
d0: 43 00 00 00 00 00 00 00 00 00 00 00 00 00 00 00
e0: 00 00 00 00 00 00 00 00 00 00 00 00 00 00 00 00
f0: 00 00 00 00 4e 01 01 42 00 00 00 00 00 00 10 00

00:01.1 PCI bridge: Intel Corporation Xeon E3-1200 v3/4th Gen Core Processor PCI Express x8 Controller (rev 06)
00: 86 80 05 0c 07 04 10 00 06 00 04 06 10 00 81 00
10: 00 00 00 00 00 00 00 00 00 02 02 00 e0 e0 00 20
20: 00 f6 00 f7 01 e0 f1 f1 00 00 00 00 00 00 00 00
30: 00 00 00 00 88 00 00 00 00 00 00 00 0b 01 18 00
40: 00 00 00 00 00 00 00 00 00 00 00 00 00 00 00 00
50: 00 00 00 00 00 00 00 00 00 00 00 00 00 00 00 00
60: 00 00 00 00 00 00 00 00 00 00 00 00 00 00 00 00
70: 00 00 00 00 00 00 00 00 00 00 00 00 00 00 00 0a
80: 01 90 03 c8 08 00 00 00 0d 80 00 00 43 10 34 85
90: 05 a0 01 00 0c f0 ef fe 91 41 00 00 00 00 00 00
a0: 10 00 42 01 00 80 00 00 00 00 00 00 83 ac 61 03
b0: 40 00 81 d0 80 25 14 00 00 00 40 00 00 00 00 00
c0: 00 00 00 00 80 0b 08 00 00 64 00 00 0e 00 00 00
d0: 43 00 1e 00 00 00 00 00 00 00 00 00 00 00 00 00
e0: 00 00 00 00 00 00 00 00 00 00 00 00 00 00 00 00
f0: 00 c0 00 00 4e 01 01 42 00 00 00 00 00 00 10 00

00:14.0 USB controller: Intel Corporation 8 Series/C220 Series Chipset Family USB xHCI (rev 04)
00: 86 80 31 8c 06 04 90 02 04 30 03 0c 00 00 00 00
10: 04 00 32 f7 00 00 00 00 00 00 00 00 00 00 00 00
20: 00 00 00 00 00 00 00 00 00 00 00 00 43 10 34 85
30: 00 00 00 00 70 00 00 00 00 00 00 00 05 01 00 00
40: fd 01 36 80 89 c6 0f 80 00 00 00 00 00 00 00 00
50: 9f 6e 88 07 00 00 00 00 00 00 00 00 00 00 00 00
60: 30 20 00 00 00 00 00 00 00 00 00 00 00 00 00 00
70: 01 80 c2 c1 08 00 00 00 00 00 00 00 00 00 00 00
80: 05 00 87 00 0c f0 ef fe 00 00 00 00 42 41 00 00
90: 00 00 00 00 00 00 00 00 00 00 00 00 00 00 00 00
a0: 40 01 00 00 00 00 00 00 00 00 00 00 00 00 00 00
b0: 0f 00 01 00 00 00 00 00 00 00 00 00 00 00 00 00
c0: 03 04 30 c0 03 0c 30 00 03 0c 30 00 00 00 00 00
d0: ff 3f 00 00 ff 3f 00 00 3f 00 00 00 3f 00 00 00
e0: a0 00 00 00 00 00 00 00 00 00 00 00 d8 d8 d8 08
f0: 00 00 00 00 00 00 00 00 b1 0f 05 08 00 00 00 00

00:16.0 Communication controller: Intel Corporation 8 Series/C220 Series Chipset Family MEI Controller #1 (rev 04)
00: 86 80 3a 8c 06 04 10 00 04 00 80 07 00 00 80 00
10: 04 b0 33 f7 00 00 00 00 00 00 00 00 00 00 00 00
20: 00 00 00 00 00 00 00 00 00 00 00 00 43 10 34 85
30: 00 00 00 00 50 00 00 00 00 00 00 00 05 01 00 00
40: 45 02 00 1e 10 00 01 80 06 23 00 66 f0 7f 00 10
50: 01 8c 03 c8 08 00 00 00 00 00 00 00 00 00 00 00
60: 00 02 00 00 00 00 00 00 00 00 00 00 00 00 00 00
70: 00 00 00 00 00 00 00 00 00 00 00 00 00 00 00 00
80: 00 00 00 00 00 00 00 00 00 00 00 00 05 00 81 00
90: 0c f0 ef fe 00 00 00 00 52 41 00 00 00 00 00 00
a0: 00 00 00 00 00 00 00 00 00 00 00 00 00 00 00 00
b0: 00 00 00 00 00 00 00 00 00 00 00 00 02 00 00 c0
c0: 55 d9 46 c0 38 60 05 52 76 f6 63 4e 79 ff 87 8e
d0: 07 10 99 f0 1c 95 6d 24 31 94 ae e6 67 b7 f5 b6
e0: 00 00 00 00 00 00 00 00 00 00 00 00 00 00 00 00
f0: 00 00 00 00 00 00 00 00 00 00 00 00 00 00 00 00

00:19.0 Ethernet controller: Intel Corporation Ethernet Connection I217-V (rev 04)
00: 86 80 3b 15 07 04 10 00 04 00 00 02 00 00 00 00
10: 00 00 30 f7 00 90 33 f7 41 f0 00 00 00 00 00 00
20: 00 00 00 00 00 00 00 00 00 00 00 00 43 10 9f 85
30: 00 00 00 00 c8 00 00 00 00 00 00 00 04 01 00 00
40: 00 00 00 00 00 00 00 00 00 00 00 00 00 00 00 00
50: 00 00 00 00 00 00 00 00 00 00 00 00 00 00 00 00
60: 00 00 00 00 00 00 00 00 00 00 00 00 00 00 00 00
70: 00 00 00 00 00 00 00 00 00 00 00 00 00 00 00 00
80: 00 00 00 00 00 00 00 00 00 00 00 00 00 00 00 00
90: 00 00 00 00 00 00 00 00 00 00 00 00 00 00 00 00
a0: 00 00 00 00 00 00 00 00 46 08 00 00 00 00 00 00
b0: 00 00 00 00 00 00 00 00 00 00 00 00 00 00 00 00
c0: 00 00 00 00 00 00 00 00 01 d0 22 c8 00 20 00 07
d0: 05 e0 81 00 0c f0 ef fe 00 00 00 00 92 41 00 00
e0: 13 00 06 03 00 00 00 00 00 00 00 00 00 00 00 00
f0: 00 00 00 00 00 00 00 00 00 00 00 00 00 00 00 00

00:1a.0 USB controller: Intel Corporation 8 Series/C220 Series Chipset Family USB EHCI #2 (rev 04)
00: 86 80 2d 8c 06 00 90 02 04 20 03 0c 00 00 00 00
10: 00 80 33 f7 00 00 00 00 00 00 00 00 00 00 00 00
20: 00 00 00 00 00 00 00 00 00 00 00 00 43 10 34 85
30: 00 00 00 00 50 00 00 00 00 00 00 00 04 01 00 00
40: 00 00 00 00 db 05 86 01 00 00 00 00 00 00 00 00
50: 01 58 c2 c9 00 00 00 00 0a 98 a0 20 00 00 00 00
60: 20 20 81 07 00 00 00 00 01 00 00 01 00 00 00 40
70: 00 00 df 3f 03 0c 30 00 4f 01 00 00 8c 40 00 00
80: 00 00 80 00 11 88 0c 93 70 0d 00 24 01 04 02 00
90: 00 00 00 00 00 00 00 00 13 00 06 03 00 00 00 00
a0: 00 00 00 00 00 00 00 00 00 00 00 00 00 00 00 00
b0: 00 00 00 00 00 00 00 00 00 00 00 00 00 00 00 00
c0: 00 00 00 00 00 00 00 00 00 00 00 00 00 00 00 00
d0: 00 00 00 00 00 aa ff 00 00 00 bd eb 27 00 00 00
e0: 00 00 00 00 ff ff ff ff ff ff ff bf f8 3d fe cd
f0: 00 00 00 00 88 85 80 00 b1 0f 05 08 08 17 1a 20

00:1b.0 Audio device: Intel Corporation 8 Series/C220 Series Chipset High Definition Audio Controller (rev 04)
00: 86 80 20 8c 06 04 10 00 04 00 03 04 10 00 00 00
10: 04 00 33 f7 00 00 00 00 00 00 00 00 00 00 00 00
20: 00 00 00 00 00 00 00 00 00 00 00 00 43 10 9d 85
30: 00 00 00 00 50 00 00 00 00 00 00 00 03 01 00 00
40: 03 00 00 17 00 00 00 00 00 00 00 00 00 80 00 00
50: 01 60 42 c8 00 00 00 00 00 00 00 00 00 00 00 00
60: 05 70 81 00 0c f0 ef fe 00 00 00 00 72 41 00 00
70: 10 00 91 00 00 00 00 10 00 00 10 00 00 00 00 00
80: 00 00 00 00 00 00 00 00 00 00 00 00 00 00 00 00
90: 00 00 00 00 00 00 00 00 00 00 00 00 00 00 00 00
a0: 00 00 00 00 00 00 00 00 00 00 00 00 00 00 00 00
b0: 00 00 00 00 00 00 00 00 00 00 00 00 00 00 00 00
c0: 00 04 02 01 00 60 00 00 00 0c 85 82 10 00 33 02
d0: 00 0c 85 02 10 00 33 02 00 00 00 00 00 00 00 00
e0: 00 00 00 00 00 00 00 00 00 00 00 00 00 00 00 00
f0: 00 00 00 00 00 00 00 00 b1 0f 05 08 00 00 00 00

00:1c.0 PCI bridge: Intel Corporation 8 Series/C220 Series Chipset Family PCI Express Root Port #1 (rev d4)
00: 86 80 10 8c 07 00 10 00 d4 00 04 06 10 00 81 00
10: 00 00 00 00 00 00 00 00 00 03 03 00 f0 00 00 20
20: f0 ff 00 00 f1 ff 01 00 00 00 00 00 00 00 00 00
30: 00 00 00 00 40 00 00 00 00 00 00 00 0b 01 10 00
40: 10 80 42 00 00 80 00 00 00 00 10 00 12 4c 31 01
50: 00 00 01 18 60 00 04 00 00 00 40 00 00 00 00 00
60: 00 00 00 00 17 08 08 00 00 04 00 00 00 00 00 00
70: 02 00 01 00 00 00 00 00 00 00 00 00 00 00 00 00
80: 05 90 00 00 00 00 00 00 00 00 00 00 00 00 00 00
90: 0d a0 00 00 43 10 34 85 00 00 00 00 00 00 00 00
a0: 01 00 03 c8 00 00 00 00 00 00 00 00 00 00 00 00
b0: 00 00 00 00 00 00 00 00 00 00 00 00 00 00 00 00
c0: 00 00 00 00 00 00 00 00 00 00 00 00 00 00 00 00
d0: 00 00 00 01 00 08 00 00 02 00 11 09 00 00 00 00
e0: 00 00 00 00 00 00 00 00 00 00 00 00 00 00 00 00
f0: 50 00 00 00 80 f5 00 00 b1 0f 05 08 01 28 0a 41

00:1c.3 PCI bridge: Intel Corporation 8 Series/C220 Series Chipset Family PCI Express Root Port #4 (rev d4)
00: 86 80 16 8c 07 00 10 00 d4 00 04 06 10 00 81 00
10: 00 00 00 00 00 00 00 00 00 04 04 00 d0 d0 00 00
20: 20 f7 20 f7 f1 ff 01 00 00 00 00 00 00 00 00 00
30: 00 00 00 00 40 00 00 00 00 00 00 00 0e 04 10 00
40: 10 80 42 01 00 80 00 00 00 00 10 00 12 3c 32 04
50: 40 00 12 70 00 b2 1c 00 00 00 40 00 00 00 00 00
60: 00 00 00 00 17 08 00 00 00 04 00 00 00 00 00 00
70: 02 00 00 00 00 00 00 00 00 00 00 00 00 00 00 00
80: 05 90 00 00 00 00 00 00 00 00 00 00 00 00 00 00
90: 0d a0 00 00 43 10 34 85 00 00 00 00 00 00 00 00
a0: 01 00 03 c8 00 00 00 00 00 00 00 00 00 00 00 00
b0: 00 00 00 00 00 00 00 00 00 00 00 00 00 00 00 00
c0: 00 00 00 00 00 00 00 00 00 00 00 00 00 00 00 00
d0: 00 00 00 01 42 18 00 00 08 80 11 8b 00 00 00 00
e0: 00 00 00 00 00 00 00 00 00 00 00 00 00 00 00 00
f0: 50 00 00 00 40 00 00 0c b1 0f 05 08 00 28 00 04

00:1c.6 PCI bridge: Intel Corporation 8 Series/C220 Series Chipset Family PCI Express Root Port #7 (rev d4)
00: 86 80 1c 8c 07 00 10 00 d4 00 04 06 10 00 81 00
10: 00 00 00 00 00 00 00 00 00 05 06 00 f0 00 00 20
20: 10 f7 10 f7 f1 ff 01 00 00 00 00 00 00 00 00 00
30: 00 00 00 00 40 00 00 00 00 00 00 00 0f 03 10 00
40: 10 80 42 01 00 80 00 00 00 00 10 00 12 3c 32 07
50: 40 00 11 70 00 b2 34 00 00 00 40 00 00 00 00 00
60: 00 00 00 00 17 08 00 00 00 04 00 00 00 00 00 00
70: 02 00 01 00 00 00 00 00 00 00 00 00 00 00 00 00
80: 05 90 00 00 00 00 00 00 00 00 00 00 00 00 00 00
90: 0d a0 00 00 43 10 34 85 00 00 00 00 00 00 00 00
a0: 01 00 03 c8 00 00 00 00 00 00 00 00 00 00 00 00
b0: 00 00 00 00 00 00 00 00 00 00 00 00 00 00 00 00
c0: 00 00 00 00 00 00 00 00 00 00 00 00 00 00 00 00
d0: 00 00 00 01 42 18 00 00 08 80 11 8b 00 00 00 00
e0: 00 00 00 00 00 00 00 00 00 00 00 00 00 00 00 00
f0: 50 00 00 00 40 00 00 0c b1 0f 05 08 00 28 00 07

00:1d.0 USB controller: Intel Corporation 8 Series/C220 Series Chipset Family USB EHCI #1 (rev 04)
00: 86 80 26 8c 06 00 90 02 04 20 03 0c 00 00 00 00
10: 00 70 33 f7 00 00 00 00 00 00 00 00 00 00 00 00
20: 00 00 00 00 00 00 00 00 00 00 00 00 43 10 34 85
30: 00 00 00 00 50 00 00 00 00 00 00 00 06 01 00 00
40: 00 00 00 00 db 05 fe 00 00 00 00 00 00 00 00 00
50: 01 58 c2 c9 00 00 00 00 0a 98 a0 20 00 00 00 00
60: 20 20 01 06 00 00 00 00 01 00 00 01 00 00 00 40
70: 00 00 df 3f 03 04 30 c0 4f 01 00 00 8c 40 00 00
80: 00 00 80 00 11 88 0c 93 70 0d 00 24 01 04 02 00
90: 00 00 00 00 00 00 00 00 13 00 06 03 00 00 00 00
a0: 00 00 00 00 00 00 00 00 00 00 00 00 00 00 00 00
b0: 00 00 00 00 00 00 00 00 00 00 00 00 00 00 00 00
c0: 00 00 00 00 00 00 00 00 00 00 00 00 00 00 00 00
d0: 00 00 00 00 00 aa ff 00 00 00 ff ff 27 00 00 00
e0: 00 00 00 00 f7 ff df ff ff ff df bf a0 b3 ae 3f
f0: 00 00 00 00 88 85 80 00 b1 0f 05 08 08 17 1a 20

00:1f.0 ISA bridge: Intel Corporation Z87 Express LPC Controller (rev 04)
00: 86 80 44 8c 07 00 10 02 04 00 01 06 00 00 80 00
10: 00 00 00 00 00 00 00 00 00 00 00 00 00 00 00 00
20: 00 00 00 00 00 00 00 00 00 00 00 00 43 10 34 85
30: 00 00 00 00 e0 00 00 00 00 00 00 00 00 00 00 00
40: 01 18 00 00 80 00 00 00 01 1c 00 00 10 00 00 00
50: f8 00 00 00 00 00 00 00 00 00 00 00 00 00 00 00
60: 8b 8a 8f 8e 90 00 00 00 84 85 83 86 f8 f0 00 00
70: 78 f0 78 f0 78 f0 78 f0 78 f0 78 f0 78 f0 78 f0
80: 10 00 0f 3c 91 02 0c 00 01 0a 7c 00 69 00 04 00
90: 00 00 00 00 00 0f 00 00 00 00 00 00 00 00 00 00
a0: 10 06 a0 18 09 38 06 00 00 46 00 00 00 00 01 80
b0: 00 00 00 00 00 00 00 00 00 01 00 20 00 00 00 00
c0: 00 00 00 00 00 00 00 00 00 00 00 00 00 00 00 00
d0: 33 22 11 00 67 45 00 00 cf ff 00 00 2a 00 00 00
e0: 09 00 0c 10 00 00 00 00 01 e8 00 91 00 00 00 00
f0: 01 c0 d1 fe 00 00 00 00 b1 0f 05 08 00 00 00 00

00:1f.2 SATA controller: Intel Corporation 8 Series/C220 Series Chipset Family 6-port SATA Controller 1 [AHCI mode] (rev 04)
00: 86 80 02 8c 07 04 b0 02 04 01 06 01 00 00 00 00
10: 91 f0 00 00 81 f0 00 00 71 f0 00 00 61 f0 00 00
20: 21 f0 00 00 00 60 33 f7 00 00 00 00 43 10 34 85
30: 00 00 00 00 80 00 00 00 00 00 00 00 0a 02 00 00
40: 00 80 00 80 00 00 00 00 00 00 00 00 00 00 00 00
50: 00 00 00 00 00 00 00 00 00 00 00 00 00 00 00 00
60: 00 00 00 00 00 00 00 00 00 00 00 00 00 00 00 00
70: 01 a8 03 40 08 00 00 00 00 00 00 00 00 00 00 00
80: 05 70 01 00 0c f0 ef fe e1 41 00 00 00 00 00 00
90: 60 2e 11 91 83 01 00 2e 20 02 5c 20 20 00 00 80
a0: a8 00 00 00 00 00 00 00 12 00 10 00 48 00 00 00
b0: 00 00 00 00 00 00 00 00 00 00 00 00 00 00 00 00
c0: 00 00 00 00 00 00 00 00 00 00 00 00 00 00 00 00
d0: 00 00 00 00 00 00 00 00 00 00 00 00 00 00 00 00
e0: 00 00 00 00 00 00 00 00 00 00 00 00 00 00 00 00
f0: 00 00 00 00 00 00 00 00 b1 0f 05 08 00 00 00 00

00:1f.3 SMBus: Intel Corporation 8 Series/C220 Series Chipset Family SMBus Controller (rev 04)
00: 86 80 22 8c 03 00 80 02 04 00 05 0c 00 00 00 00
10: 04 50 33 f7 00 00 00 00 00 00 00 00 00 00 00 00
20: 01 f0 00 00 00 00 00 00 00 00 00 00 43 10 34 85
30: 00 00 00 00 00 00 00 00 00 00 00 00 0f 03 00 00
40: 01 00 00 00 00 00 00 00 00 00 00 00 00 00 00 00
50: 00 00 00 00 00 00 00 00 00 00 00 00 00 00 00 00
60: 03 04 04 00 00 00 08 08 00 00 00 00 00 00 00 00
70: 00 00 00 00 00 00 00 00 00 00 00 00 00 00 00 00
80: 04 00 00 00 00 00 00 00 00 00 00 00 00 00 00 00
90: 00 00 00 00 00 00 00 00 00 00 00 00 00 00 00 00
a0: 00 00 00 00 00 00 00 00 00 00 00 00 00 00 00 00
b0: 00 00 00 00 00 00 00 00 00 00 00 00 00 00 00 00
c0: 00 00 00 00 00 00 00 00 00 00 00 00 00 00 00 00
d0: 00 00 00 00 00 00 00 00 00 00 00 00 00 00 00 00
e0: 00 00 00 00 00 00 00 00 00 00 00 00 00 00 00 00
f0: 00 00 00 00 00 00 00 00 b1 0f 05 08 00 00 00 00

02:00.0 VGA compatible controller: NVIDIA Corporation Device 1c03 (rev a1)
00: de 10 03 1c 03 00 10 00 a1 00 00 03 10 00 80 00
10: 00 00 00 f6 0c 00 00 e0 00 00 00 00 0c 00 00 f0
20: 00 00 00 00 01 e0 00 00 00 00 00 00 de 10 d7 11
30: 00 00 00 f7 60 00 00 00 00 00 00 00 0a 01 00 00
40: de 10 d7 11 00 00 00 00 00 00 00 00 00 00 00 00
50: 01 00 00 00 01 00 00 00 ce d6 23 00 00 00 00 00
60: 01 68 03 00 08 00 00 00 05 78 80 00 00 00 00 00
70: 00 00 00 00 00 00 00 00 10 00 12 00 e1 8d 2c 01
80: 00 29 09 00 03 3d 45 01 40 00 81 10 00 00 00 00
90: 00 00 00 00 00 00 00 00 00 00 00 00 13 08 04 00
a0: 00 04 00 00 0e 00 00 00 03 00 1f 00 00 00 00 00
b0: 00 00 00 00 09 00 14 01 00 00 00 00 00 00 00 00
c0: 00 00 00 00 00 00 00 00 00 00 00 00 00 00 00 00
d0: 00 00 00 00 00 00 00 00 00 00 00 00 00 00 00 00
e0: 00 00 00 00 00 00 00 00 00 00 00 00 00 00 00 00
f0: 00 00 00 00 00 00 00 00 00 00 00 00 00 00 00 00

02:00.1 Audio device: NVIDIA Corporation Device 10f1 (rev a1)
00: de 10 f1 10 06 00 10 00 a1 00 03 04 10 00 80 00
10: 00 00 08 f7 00 00 00 00 00 00 00 00 00 00 00 00
20: 00 00 00 00 00 00 00 00 00 00 00 00 de 10 d7 11
30: 00 00 00 00 60 00 00 00 00 00 00 00 0f 02 00 00
40: de 10 d7 11 00 00 00 00 00 00 00 00 00 00 00 00
50: 00 00 00 00 00 00 00 00 ce d6 23 00 00 00 00 00
60: 01 68 03 00 08 00 00 00 05 78 80 00 00 00 00 00
70: 00 00 00 00 00 00 00 00 10 00 02 00 e1 8d 2c 01
80: 00 29 09 00 03 3d 45 01 40 00 81 10 00 00 00 00
90: 00 00 00 00 00 00 00 00 00 00 00 00 13 08 04 00
a0: 00 00 00 00 0e 00 00 00 00 00 01 00 00 00 00 00
b0: 00 00 00 00 00 00 00 00 00 00 00 00 00 00 00 00
c0: 00 00 00 00 00 00 00 00 00 00 00 00 00 00 00 00
d0: 00 00 00 00 00 00 00 00 00 00 00 00 00 00 00 00
e0: 00 00 00 00 00 00 00 00 00 00 00 00 00 00 00 00
f0: 00 00 00 00 00 00 00 00 00 00 00 00 00 00 00 00

04:00.0 SATA controller: ASMedia Technology Inc. ASM1062 Serial ATA Controller (rev 01)
00: 21 1b 12 06 07 04 10 00 01 01 06 01 10 00 00 00
10: 51 d0 00 00 41 d0 00 00 31 d0 00 00 21 d0 00 00
20: 01 d0 00 00 00 00 20 f7 00 00 00 00 43 10 8d 85
30: 00 00 00 00 50 00 00 00 00 00 00 00 0e 01 00 00
40: 00 00 00 00 60 61 11 02 00 00 00 00 00 00 00 00
50: 05 78 01 00 0c f0 ef fe 22 41 00 00 00 00 00 00
60: 00 00 00 00 00 00 00 00 11 78 01 00 00 00 00 00
70: 00 00 00 00 00 00 00 00 01 80 03 00 00 00 00 00
80: 10 00 12 00 02 87 90 05 00 28 01 00 12 b4 00 01
90: 40 00 12 10 00 00 00 00 00 00 00 00 00 00 00 00
a0: 00 00 00 00 17 00 00 00 00 00 00 00 00 00 00 00
b0: 02 00 00 00 00 00 00 00 00 00 00 00 00 00 00 00
c0: 00 00 00 00 00 00 00 00 00 00 00 00 00 00 00 00
d0: 00 00 00 00 00 00 00 00 00 00 00 00 00 00 00 00
e0: 00 00 00 00 00 00 00 00 00 00 00 00 63 00 00 00
f0: ff ff 00 00 10 00 00 00 00 00 00 00 00 00 00 03

05:00.0 PCI bridge: Pericom Semiconductor PI7C9X111SL PCIe-to-PCI Reversible Bridge (rev 02)
00: d8 12 11 e1 07 00 10 00 02 00 04 06 10 00 01 00
10: 00 00 00 00 00 00 00 00 05 06 06 20 f1 01 a0 22
20: 10 f7 10 f7 f1 ff 01 00 00 00 00 00 00 00 00 00
30: 00 00 00 00 80 00 00 00 00 00 00 00 0f 01 10 00
40: 20 00 20 09 00 00 00 00 1f 80 40 00 00 00 00 00
50: 00 00 00 00 00 00 00 00 00 00 00 00 00 00 00 00
60: 00 00 00 00 00 00 00 00 00 08 00 b8 00 00 00 00
70: 80 00 00 00 00 00 00 00 00 00 00 f0 00 00 00 00
80: 07 90 00 00 00 05 00 00 10 00 10 00 10 00 10 00
90: 01 a8 43 c8 00 00 00 00 00 00 00 00 00 00 00 00
a0: 04 b0 00 00 00 00 01 00 0d b0 00 00 00 00 00 00
b0: 10 f0 71 00 22 80 00 00 00 20 12 00 11 3c 00 00
c0: 40 00 11 30 00 00 00 00 00 00 00 01 60 10 00 04
d0: 71 02 00 04 54 02 19 00 03 f0 00 00 00 00 00 00
e0: 00 00 00 00 00 00 00 00 00 00 00 00 00 00 00 00
f0: 05 00 80 00 00 00 00 00 00 00 00 00 00 00 00 00

06:04.0 Multimedia video controller: Techwell Inc. Device 6804 (rev 10)
00: 97 17 04 68 06 00 b0 02 10 00 00 04 10 20 80 00
10: 00 10 10 f7 00 00 00 00 00 00 00 00 00 00 00 00
20: 00 00 00 00 00 00 00 00 00 00 00 00 00 f3 ab 12
30: 00 00 00 00 44 00 00 00 00 00 00 00 0f 01 20 48
40: 00 00 00 00 01 00 22 00 00 00 00 00 00 00 00 00
50: 00 00 00 00 00 00 00 00 00 00 00 00 00 00 00 00
60: 00 00 00 00 00 00 00 00 00 00 00 00 00 00 00 00
70: 00 00 00 00 00 00 00 00 00 00 00 00 00 00 00 00
80: 00 00 00 00 00 00 00 00 00 00 00 00 00 00 00 00
90: 00 00 00 00 00 00 00 00 00 00 00 00 00 00 00 00
a0: 00 00 00 00 00 00 00 00 00 00 00 00 00 00 00 00
b0: 00 00 00 00 00 00 00 00 00 00 00 00 00 00 00 00
c0: 00 00 00 00 00 00 00 00 00 00 00 00 00 00 00 00
d0: 00 00 00 00 00 00 00 00 00 00 00 00 00 00 00 00
e0: 00 00 00 00 00 00 00 00 00 00 00 00 00 00 00 00
f0: 00 00 00 00 00 00 00 00 00 00 00 00 00 00 00 00

06:04.1 Multimedia controller: Techwell Inc. Device 6805 (rev 10)
00: 97 17 05 68 06 00 b0 02 10 00 80 04 10 20 80 00
10: 00 00 10 f7 00 00 00 00 00 00 00 00 00 00 00 00
20: 00 00 00 00 00 00 00 00 00 00 00 00 00 f3 ab 12
30: 00 00 00 00 44 00 00 00 00 00 00 00 0f 01 20 48
40: 00 00 00 00 01 00 22 00 00 00 00 00 00 00 00 00
50: 00 00 00 00 00 00 00 00 00 00 00 00 00 00 00 00
60: 00 00 00 00 00 00 00 00 00 00 00 00 00 00 00 00
70: 00 00 00 00 00 00 00 00 00 00 00 00 00 00 00 00
80: 00 00 00 00 00 00 00 00 00 00 00 00 00 00 00 00
90: 00 00 00 00 00 00 00 00 00 00 00 00 00 00 00 00
a0: 00 00 00 00 00 00 00 00 00 00 00 00 00 00 00 00
b0: 00 00 00 00 00 00 00 00 00 00 00 00 00 00 00 00
c0: 00 00 00 00 00 00 00 00 00 00 00 00 00 00 00 00
d0: 00 00 00 00 00 00 00 00 00 00 00 00 00 00 00 00
e0: 00 00 00 00 00 00 00 00 00 00 00 00 00 00 00 00
f0: 00 00 00 00 00 00 00 00 00 00 00 00 00 00 00 00

